{
  "package_id": "EVP-20260703T215734Z-2149",
  "mission_id": "MSN-20260703T215701Z-3014",
  "objective": "Assess whether ForgeWorld's own repo can demonstrate offline phone->laptop continuity",
  "observations": [
    "Repo has substrate/ built last session but no phone-native sensor mission object yet | context: Continuity Substrate Ascension V1 directive, module 01"
  ],
  "supporting_evidence": [
    {
      "evidence_id": "EVD-20260703T215701Z-3388",
      "description": "Promoted from sensor mission PSM-20260703T215640Z-1840: This directive text + prior substrate/README.md",
      "ref": "PSM-20260703T215640Z-1840",
      "captured_at": "2026-07-03T21:56:40Z"
    }
  ],
  "confidence_score": "unknown",
  "related_knowledge": [],
  "required_validation": "manual review by laptop operator before commercial use",
  "commercial_relevance": "unknown",
  "traceability": {
    "mission_id": "MSN-20260703T215701Z-3014",
    "event_ids": [
      "EVT-20260703T215702Z-3229"
    ],
    "evidence_ids": [
      "EVD-20260703T215701Z-3388"
    ]
  },
  "source_history": [
    "MSN-20260703T215701Z-3014",
    "EVT-20260703T215702Z-3229"
  ],
  "created_at": "2026-07-03T21:57:34Z",
  "integrity_hash": "e9c97c126f57bc16ae84da4f50056c1e496c2635369d52e9d798101066cadfd3",
  "synchronization_metadata": {
    "state": "local_only",
    "generated_by": "laptop"
  }
}
